<?xml version='1.0' encoding='utf-8'?>
<ns0:SMC_Adressen xmlns:ns0="http://ccsap.bit.admin.ch/SWISSMEDIC/LIMS_HMIT_KHZ" xmlns:xsi="http://www.w3.org/2001/XMLSchema-instance" xsi:schemaLocation="http://ccsap.bit.admin.ch/SWISSMEDIC/LIMS_HMIT_KHZ https://ogd.swissmedic.ch/hmd/ZL/172/Beschreibungen/OGD-Adressen.xsd"><ADRESSEN><PARTNER_NR>1000324</PARTNER_NR><FIRMENNAME>Max Zeller Söhne AG</FIRMENNAME><ADRESSZEILE_1>Seeblickstrasse 4</ADRESSZEILE_1><ADRESSZEILE_2 /><LAND_CODE>CH</LAND_CODE><PLZ>8590</PLZ><ORT>Romanshorn</ORT><SPRACH_CODE>D</SPRACH_CODE><KANTON>TG</KANTON></ADRESSEN><ADRESSEN><PARTNER_NR>1001056</PARTNER_NR><FIRMENNAME>THEA Pharma S.A.</FIRMENNAME><ADRESSZEILE_1>Moserstrasse 27</ADRESSZEILE_1><ADRESSZEILE_2 /><LAND_CODE>CH</LAND_CODE><PLZ>8200</PLZ><ORT>Schaffhausen</ORT><SPRACH_CODE>F</SPRACH_CODE><KANTON>SH</KANTON></ADRESSEN><ADRESSEN><PARTNER_NR>1002404</PARTNER_NR><FIRMENNAME>Almirall AG</FIRMENNAME><ADRESSZEILE_1>Alte Winterthurerstrasse 14</ADRESSZEILE_1><ADRESSZEILE_2 /><LAND_CODE>CH</LAND_CODE><PLZ>8304</PLZ><ORT>Wallisellen</ORT><SPRACH_CODE>D</SPRACH_CODE><KANTON>ZH</KANTON></ADRESSEN><ADRESSEN><PARTNER_NR>1002610</PARTNER_NR><FIRMENNAME>Uriach Switzerland AG</FIRMENNAME><ADRESSZEILE_1>Weidenweg 15</ADRESSZEILE_1><ADRESSZEILE_2 /><LAND_CODE>CH</LAND_CODE><PLZ>4310</PLZ><ORT>Rheinfelden</ORT><SPRACH_CODE>D</SPRACH_CODE><KANTON>AG</KANTON></ADRESSEN></ns0:SMC_Adressen>